Index,Blog_name,Blog Details,Blog Author,Related_images
21,A Guide to Sugar,"<p>Sugar is a sneaky little ingredient that's in a considerable amount of foods in many different forms. Despite its delicious and innocent taste, sugar has addictive properties and is linked to a variety of preventable health conditions. Although it's easy to label all sugar as ""bad"", there are types that, when eaten in moderation, may have nutritional benefits.</p>

<p>Types of sugars-
Sugar is a type of carbohydrate found in both food and beverages. Once eaten, sugar is broken down into what's called glucose which is ultimately used for energy. Let's break it down some more with the most common types and examples:Monosaccharides: glucose, galactose, fructose .Disaccharides: sucrose, lactose, maltose.Oligosaccharides: maltodextrin, raffinose.Polyols (sugar alcohols): sorbitol, mannitol, xylitol</p>

<p>Natural vs. added sugars ......
Natural sugars are sugars that are naturally found in foods. These sugars are often found in foods such as fruit, potatoes, yams, and cow's milk.

Added sugars are sugars that are added to foods during processing. These sugars are usually added for preservation, texture, mouthfeel, and taste. Added sugars are often found in foods such as soda/pop beverages, sweetened coffee or tea, cocktails, energy or sports beverages, fruit juice, store-bought cereals, soups, salad dressings, oatmeal, candies, baked goods, ice cream, and pudding. Limiting our intake of added sugars is generally recommended for overall health. 
</p>
<p>
Liquid sweeteners such as maple syrup, blackstrap molasses, agave syrup, and corn syrup are all considered to be sugars too. They contain about the same amount of calories as white sugar and are generally broken down in the same way. Some have trace minerals in very small amounts. Here at PUL, we love to use these sweeteners for their wonderful flavours and consistencies in particular recipes. It's still generally best to still consume them in moderation though.

Coconut sugar-
Coconut sugar is known to have a small trace amount of minerals, but it's nutritionally identical to white granulated sugar. With that being said, it's best to consume coconut sugar at the same level of moderation.

Effects of excess added sugars-
Consuming excess added sugars can contribute to the development of several health effects. Fatigue, weight gain, dental cavities, type 2 diabetes, hypertension, and heart disease have all been linked to excessive intake of sugars.</p>

<p>Artificial Sweeteners-
Artificial sweeteners are sugar substitutes that are zero- or low-calorie alternatives to the sugar options mentioned above. Due to this, companies market their products as ""sugar-free"", ""diet"" or ""no calories"". They're found in many diabetic products because they have little or no effect on blood sugar levels. Some can be made from natural leaf extracts, and some are manufactured. Most artificial sweeteners are also remarkably sweeter when compared to table sugar. This means that smaller amounts can be used to create the same sweetness level. Some examples of artificial sweeteners include acesulfame potassium, aspartame, cyclamate, neotame, saccharin, stevia or steviol, and sucralose.</p>

<p>Considerations with artificial sweeteners-
Conflicting evidence: according to recent high-quality research, artificial sweeteners haven't been linked to health outcomes such as diabetes, kidney disease, high blood pressure, certain cancers or dental health. According to other analyses though, they have been associated with increased BMI and other complications. In short, there are biases and limitations to the studies conducted so far and more research is needed.

Artificial sweeteners as a ""free-pass"": when people consciously know they're having artificial sweeteners with no calories, they may mentally feel able to compensate with something that does have sugar later on. Others may contain them in excess due to the ""low calorie"" or ""no calorie"" label. 

Potential gastrointestinal intolerances: some artificial sweeteners include sugar alcohols, which if consumed in large amounts (say, in a beverage) can have a laxative effect.
</p>

<p>Effects on the brain: consuming artificial sweeteners lights up similar regions of the brain in terms of satisfaction as with all other types of sugar. With this in mind, artificial sweeteners may not actually help curb sugar cravings from the root because we still tend to crave something sweet. In fact, one study suggests that we use sweet taste to predict the calories in a particular food. When our bodies receive these non-caloric sweeteners instead, it realizes the discrepancy and continues to crave, and can potentially eat even more.</p>",PickUp Limes,Blogs/21.jpg
22,Corona Virus Disease,"<p>Coronavirus disease (COVID-19) is an infectious disease caused by the SARS-CoV-2 virus.</p>

<p>Most people infected with the virus will experience mild to moderate respiratory illness and recover without requiring special treatment. However, some will become seriously ill and require medical attention. Older people and those with underlying medical conditions like cardiovascular disease, diabetes, chronic respiratory disease, or cancer are more likely to develop serious illness. Anyone can get sick with COVID-19 and become seriously ill or die at any age. </p>

<p>The best way to prevent and slow down transmission is to be well informed about the disease and how the virus spreads. Protect yourself and others from infection by staying at least 1 metre apart from others, wearing a properly fitted mask, and washing your hands or using an alcohol-based rub frequently. Get vaccinated when it’s your turn and follow local guidance.</p>

<p>The virus can spread from an infected person’s mouth or nose in small liquid particles when they cough, sneeze, speak, sing or breathe. These particles range from larger respiratory droplets to smaller aerosols. It is important to practice respiratory etiquette, for example by coughing into a flexed elbow, and to stay home and self-isolate until you recover if you feel unwell.</p>",WHO,Blogs/22.jpg
23,Spices for you Meal,"<p>Herbs and spices can pack a punch, especially when added to your favourite dishes. However, few people realize just how much simple seasonings can benefit their health. From coriander to turmeric, herbs can boost your mental, emotional and physical well-being. Here are a few of the most effective ones and how to use them to spice up your meals.</p>

<p>1. Cilantro-
If you’re looking to add a hint of spice to Mexican or Indian cuisine, try chopped cilantro. This fresh herb is bright green and brimming with health benefits.
Reduce your risk of Alzheimer’s disease, diabetes and Parkinson’s disease with a sprinkle of fresh or dried cilantro. Ground coriander — or cilantro seed — is just as effective when added to meals as it contains linalool, an essential oil that combats anxiety, depression and even insomnia.</p>

<p>2. Chives-
Chives are in the onion family, so they’re sure to add a kick to any meal you use them in. Simply dice up a few thin stalks and use them as a garnish on everything from mashed potatoes to soups to casseroles. They’re also delicious atop sushi and other Asian-inspired cuisines like stir-fry.On top of being downright delicious, chives also happen to make a nutritious addition to your diet. The herb is super rich in specific vitamins and antioxidants that help fight cancer, boost your bone health and improve sleep.</p>

<p>3. Basil-
Perhaps you’ve used basil to make pesto or as a topping on Margherita pizza. This herb is more versatile than most people realize. While it tastes deliciously peppery in practically any Italian recipe, it’s also good in salads, Thai dishes and cocktails. A little goes a long way, so grab a bunch at the grocery store or plant your own herb garden to keep those green leaves growing.</p>



<p>4. Rosemary-
The active ingredient in rosemary is rosmarinic acid, a powerful substance that can do wonders for your sinuses. Got allergies? Try adding some rosemary to a lemon or butter-based chicken dish. The meal will suppress your allergic response and reduce nasal congestion so you can breathe easily and taste what you’re eating.Rosemary is also rich in antioxidants and anti-inflammatory compounds, which can boost circulation and improve the immune system. Even the aroma of this potent herb can improve your mood and clear the mind. Feel free to open the oven and take in a few big whiffs as dinner cooks.</p>

<p>5. Sage-
Sage has a strong reputation for its healing properties. Many people even burn dried bundles of the herb within their homes to cleanse the space and promote wisdom. The ancient Romans and Egyptians used it to treat digestive issues, memory problems and sore throats, so it makes sense that sage is still a popular herb today.Sage complements a wide variety of flavours, especially during the fall. Autumn flavours in dishes like roasted butternut squash, pumpkin lasagna and grilled cheese all pair well with a sprinkle of dried sage. Some meats, including turkey and sea bass, also taste better with a pinch of this delicious herb.</p>

<p>6. Turmeric-
If you’ve ever had Indian food, you’ve likely tried turmeric. This bright yellow spice is a staple in many Eastern cultures, and just a spoonful is enough to tinge an entire pot of soup, rice or golden milk a beautiful sunny hue. It also adds a pungent, earthy-sweet taste to practically any dish.



<p>7. Peppermint-
Peppermint should be your go-to herb of choice when you want to freshen your breath or brighten up a spring salad. Aside from using it to make tea or refreshingly delicious cocktails, you can use mint in pestos, dukkah, pasta, fritters and more. When in doubt, add a sprig atop fruity or chocolatey desserts to really make your taste buds tingle.</p>

<p>Eating this herb can calm irritable bowel syndrome and relieve indigestion, whether you sip mint tea or consume the plant’s leaves. It’s also high in iron, vitamin A and antioxidants, like many other leafy green herbs on this list.

<p>Adding More Healthy Herbs to Your Diet-
Adding healthy herbs to your diet doesn’t have to be difficult. In fact, most will complement a wide variety of dishes, so there’s certainly room for experimentation. Add fresh or dried herbs to dinners, desserts, drinks and more to discover the tastiest — and healthiest — combinations. The more recipes you try, the more apt you are to make herbs a staple ingredient in your kitchen.
</p>



",Healthy living,Blogs/23.jpg
24,A Guide to Cancer,"<p>Cancer begins in your cells, which are the building blocks of your body. Normally, your body forms new cells as you need them, replacing old cells that die. Sometimes this process goes wrong. New cells grow even when you don't need them, and old cells don't die when they should. These extra cells can form a mass called a tumor. Tumors can be benign or malignant. Benign tumors aren't cancer while malignant ones are. Cells from malignant tumors can invade nearby tissues. They can also break away and spread to other parts of the body.</p>

<p>Cancer is not just one disease but many diseases. There are more than 100 different types of cancer. Most cancers are named for where they start. For example, lung cancer starts in the lung, and breast cancer starts in the breast. The spread of cancer from one part of the body to another is called metastasis. Symptoms and treatment depend on the cancer type and how advanced it is. Most treatment plans may include surgery, radiation and/or chemotherapy. Some may involve hormone therapy, immunotherapy or other types of biologic therapy, or stem cell transplantation.</p>",MediLine Plus,Blogs/24.jpg
25,Plant Based Diet,"<p>Dropping the phrase “plant-based diet” is hip when talking nutrition these days. But why is it so hot right now? Lauren Manaker, RDN, who is based in Charleston, South Carolina, suspects it’s because of increased awareness of the health and environmental benefits that come along with eating this way. Some of that could be the result of documentaries that throw shade at eating meat and other animal products, such as What the Health (2017), Cowspiracy (2014), and Forks Over Knives (2011).But what does “plant-based diet” mean, anyway? Is it the same thing as being vegetarian or vegan? Or does this diet just mean you make an effort to pack more veggies into your meals?</p>

<p>Technically, all of the above interpretations are correct. “Some people use the term ‘plant-based diet’ as a synonym for the vegan diet,” says Summer Yule, RDN, a nutritionist based in Hartford, Connecticut. “Others may use the term in a broader way that includes all vegetarian diets, and I’ve also seen people use ‘plant-based’ to mean diets that are composed mostly, but not entirely, of plant foods.”</p>

<p>The main idea is to make plant-based foods the central part of your meals. “A plant-based diet emphasizes foods like fruits, vegetables, and beans, and limits foods like meats, dairy, and eggs,” Manaker says. From there, more restrictions could be put in place depending on how strict you want to be. “It may completely eliminate foods from animals or just limit intake, depending on the individual’s interpretation,” Manaker says.That means meat and seafood don’t necessarily need to be off-limits — you might just decide to cut down on how frequently you eat those items.</p>

<p>Think of “plant-based” as a broad category of diets, with other more specific diets falling under its umbrella. For example, the Mediterranean diet is a version of a plant-based diet because even though it incorporates fish and poultry, the emphasis is on plant-based foods, Manaker says.Vegetarian and vegan diets are also plant-based. (1) Whole30, a popular diet and lifestyle plan, doesn’t usually qualify. “The Whole30 diet traditionally is heavier on animal proteins, though it is possible to follow this diet in a plant-based way,” </p>", Moira Lawler,Blogs/25.jpg
